### ISSUE TITLE
`images:ubuntu/{noble,questing}/desktop` unable to get IP when `ipv4.nat=false`

### ISSUE THREAD

**Issue by MggMuggins** [canonical/lxd#17672]
### Please confirm

- [x] I have searched existing issues to check if an issue already exists for the bug I encountered.

### Distribution

Ubuntu

### Distribution version

24.04

### Output of "snap list --all lxd core20 core22 core24 snapd"

```shell
Name    Version         Rev    Tracking        Publisher   Notes
core22  20251125        2216   latest/stable   canonical✓  base,disabled
core22  20260113        2292   latest/stable   canonical✓  base
core24  20251210        1267   latest/stable   canonical✓  base,disabled
core24  20260107        1349   latest/stable   canonical✓  base
lxd     5.21.4-31e012b  37727  5.21/candidate  canonical✓  disabled,in-cohort
lxd     5.21.4-bcc182c  37834  5.21/candidate  canonical✓  in-cohort
snapd   2.72            25577  latest/stable   canonical✓  snapd,disabled
snapd   2.73            25935  latest/stable   canonical✓  snapd
```

### Output of "lxc info" or system info if it fails

```shell
# Partial lxc info
config:
  core.bgp_address: :179
  core.bgp_asn: "65200"
  ...
api_status: stable
api_version: "1.0"
auth: trusted
public: false
auth_methods:
- tls
client_certificate: false
environment:
  driver: lxc | qemu
  driver_version: 6.0.4 | 8.2.2
  instance_types:
  - container
  - virtual-machine
  firewall: nftables
  kernel: Linux
  kernel_architecture: x86_64
  kernel_features:
    bpf_token: "false"
    idmapped_mounts: "true"
    netnsid_getifaddrs: "true"
    seccomp_listener: "true"
    seccomp_listener_continue: "true"
    uevent_injection: "true"
    unpriv_binfmt: "true"
    unpriv_fscaps: "true"
  kernel_version: 6.8.0-90-generic
  lxc_features:
    cgroup2: "true"
    core_scheduling: "true"
    devpts_fd: "true"
    idmapped_mounts_v2: "true"
    mount_injection_file: "true"
    network_gateway_device_route: "true"
    network_ipvlan: "true"
    network_l2proxy: "true"
    network_phys_macvlan_mtu: "true"
    network_veth_router: "true"
    pidfd: "true"
    seccomp_allow_deny_syntax: "true"
    seccomp_notify: "true"
    seccomp_proxy_send_notify_fd: "true"
  os_name: Ubuntu
  os_version: "24.04"
  project: ...
  server: lxd
  server_clustered: true
  server_event_mode: full-mesh
  server_name: canaveral
  server_pid: 855657
  server_version: 5.21.4
  server_lts: true
  storage: cephfs | ceph | zfs
  storage_version: 17.2.9 | 17.2.9 | 2.2.2-0ubuntu9.4
  storage_supported_drivers:
  - name: btrfs
    version: 5.16.2
    remote: false
  - name: cephfs
    version: 17.2.9
    remote: true
  - name: cephobject
    version: 17.2.9
    remote: true
  - name: dir
    version: "1"
    remote: false
  - name: ceph
    version: 17.2.9
    remote: true
  - name: lvm
    version: 2.03.11(2) (2021-01-08) / 1.02.175 (2021-01-08) / 4.48.0
    remote: false
  - name: powerflex
    version: 1.16 (nvme-cli)
    remote: true
  - name: pure
    version: 2.1.9 (iscsiadm) / 1.16 (nvme-cli)
    remote: true
  - name: zfs
    version: 2.2.2-0ubuntu9.4
    remote: false
```

### Issue description

I'm unable to pick up an ip addr when deploying `images:ubuntu/{noble,questing}/desktop` on an OVN network where `ipv4.nat=false`:

```
Feb 16 11:06:37 qd0 NetworkManager[7514]: <warn>  [1771261597.9103] device (enp5s0): IP address 10.172.10.5 cannot be configured because it is already in use in the network by host 00:16:3E:6F:D0:84
Feb 16 11:06:37 qd0 NetworkManager[7514]: <info>  [1771261597.9131] dhcp4 (enp5s0): state changed new lease, address=10.172.10.5, acd conflict
Feb 16 11:06:39 qd0 ModemManager[5240]: <wrn> [plugin-manager] task 1,enp5s0: error when checking support with plugin 'generic': (generic) Missing port probe for port (net/enp5s0)
```

To be clear, `10.172.10.5` is the instance NIC's IP, and `00:16:3E:6F:D0:84` is the MAC of the OVN router (see `ovn-nbctl show` below).

It works fine on `jammy` images; NetworkManager upstream [introduced IPv4 DAD by default](https://gitlab.freedesktop.org/NetworkManager/NetworkManager/-/commit/790e4231f42db3ed8f07cfd6d9b1ef703439df90) in version 1.46, which landed in Noble.

I'm fairly confident that the culprit is `ipv4.nat: "false"`:
```
$ lxc network show default
name: default
description: ""
type: ovn
managed: true
status: Created
config:
  bridge.mtu: "1442"
  dns.domain: krb-00425248.wh.omg.lol
  dns.zone.forward: krb-00425248.wh.omg.lol
  dns.zone.reverse.ipv4: 10.172.10.in-addr.arpa
  ipv4.address: 10.172.10.1/24
  ipv4.nat: "false"
  ipv6.nat: "false"
  network: UPLINK
  volatile.network.ipv4.address: 10.0.0.32
...
```

`00:16:3E:6F:D0:84` is the gateway MAC for the OVN network, it appears in only the places I'd expect to see it from `microovn.ovn-nbctl show` (that is, in the LRPs `lxd-netXX-lr-lrp-{ext,int}`):
```
router 41c81ad5-fa7c-4718-a848-71a3344d27c7 (lxd-net77-lr)
    port lxd-net77-lr-lrp-ext
        mac: "00:16:3e:6f:d0:84"
        networks: ["10.0.0.32/23"]
    port lxd-net77-lr-lrp-int
        mac: "00:16:3e:6f:d0:84"
        networks: ["10.172.10.1/24"]
    nat 998ed630-bc54-4421-98db-1f97f22ba142
        external ip: "10.172.10.5"
        logical ip: "10.172.10.5"
        type: "dnat_and_snat"
    ...
```

It looks like the router is responding to `arp`s for `10.172.10.5` on both it's internal and external ports:
```
$ sudo tcpdump -i tapdb9494ef
tcpdump: verbose output suppressed, use -v[v]... for full protocol decode
listening on tapdb9494ef, link-type EN10MB (Ethernet), snapshot length 262144 bytes
11:26:59.736232 IP6 :: > ff02::16: HBH ICMP6, multicast listener report v2, 2 group record(s), length 48
11:26:59.814234 IP6 :: > ff02::16: HBH ICMP6, multicast listener report v2, 2 group record(s), length 48
11:27:00.795178 IP 0.0.0.0.bootpc > 255.255.255.255.bootps: BOOTP/DHCP, Request from 00:16:3e:b4:cb:88 (oui Unknown), length 281
11:27:00.797223 IP 10.172.10.1.bootps > 10.172.10.5.bootpc: BOOTP/DHCP, Reply, length 311
11:27:00.797348 IP6 :: > ff02::16: HBH ICMP6, multicast listener report v2, 1 group record(s), length 28
11:27:00.812454 IP 0.0.0.0.bootpc > 255.255.255.255.bootps: BOOTP/DHCP, Request from 00:16:3e:b4:cb:88 (oui Unknown), length 293
11:27:00.813153 IP 10.172.10.1.bootps > 10.172.10.5.bootpc: BOOTP/DHCP, Reply, length 311
11:27:00.829608 ARP, Request who-has 10.172.10.5 tell 0.0.0.0, length 28
11:27:00.829998 ARP, Reply 10.172.10.5 is-at 00:16:3e:6f:d0:84 (oui Unknown), length 28
...
11:27:10.841104 IP 0.0.0.0.bootpc > 255.255.255.255.bootps: BOOTP/DHCP, Request from 00:16:3e:b4:cb:88 (oui Unknown), length 281
11:27:10.842361 IP 10.172.10.1.bootps > 10.172.10.5.bootpc: BOOTP/DHCP, Reply, length 311
11:27:13.030403 IP 0.0.0.0.bootpc > 255.255.255.255.bootps: BOOTP/DHCP, Request from 00:16:3e:b4:cb:88 (oui Unknown), length 281
11:27:13.031685 IP 10.172.10.1.bootps > 10.172.10.5.bootpc: BOOTP/DHCP, Reply, length 311
11:27:13.654810 IP6 fe80::216:3eff:feb4:cb88 > ip6-allrouters: ICMP6, router solicitation, length 16
11:27:17.054341 IP6 fe80::216:3eff:feb4:cb88.mdns > ff02::fb.mdns: 0 [2q] PTR (QM)? _ipps._tcp.local. PTR (QM)? _ipp._tcp.local. (45)
11:27:17.419260 IP 0.0.0.0.bootpc > 255.255.255.255.bootps: BOOTP/DHCP, Request from 00:16:3e:b4:cb:88 (oui Unknown), length 281
11:27:17.420317 IP 10.172.10.1.bootps > 10.172.10.5.bootpc: BOOTP/DHCP, Reply, length 311
11:27:26.097937 IP 0.0.0.0.bootpc > 255.255.255.255.bootps: BOOTP/DHCP, Request from 00:16:3e:b4:cb:88 (oui Unknown), length 281
11:27:26.099415 IP 10.172.10.1.bootps > 10.172.10.5.bootpc: BOOTP/DHCP, Reply, length 311
11:27:30.039462 IP6 fe80::216:3eff:feb4:cb88 > ip6-allrouters: ICMP6, router solicitation, length 16
11:27:30.838207 ARP, Request who-has 10.172.10.5 tell 0.0.0.0, length 28
11:27:30.838993 ARP, Reply 10.172.10.5 is-at 00:16:3e:6f:d0:84 (oui Unknown), length 28
11:27:33.058069 IP6 fe80::216:3eff:feb4:cb88.mdns > ff02::fb.mdns: 0 [2q] PTR (QM)? _ipps._tcp.local. PTR (QM)? _ipp._tcp.local. (45)
11:27:42.180932 IP 0.0.0.0.bootpc > 255.255.255.255.bootps: BOOTP/DHCP, Request from 00:16:3e:b4:cb:88 (oui Unknown), length 281
11:27:42.182802 IP 10.172.10.1.bootps > 10.172.10.5.bootpc: BOOTP/DHCP, Reply, length 311
```

@tomponline pointed out that [it's expected](https://documentation.ubuntu.com/lxd/latest/reference/network_physical/#network-physical-network-conf:ovn.ingress_mode) for the router to respond (on the `UPLINK`) to ARPs for IPs in its internal network ([code reference](https://github.com/canonical/lxd/blob/dac5d3b85054c6098d57e4afc776364741b4be26/lxd/network/driver_ovn.go#L4130)).

Setting `ovn.ingress_mode=routed` on the `UPLINK` fixes this by removing the extra OVN NB `nat` entries, which prevent the ARPs that cause NetworkManager's DAD to fail.

Filing this issue to document this behavior and discuss the possibility of changing the default value of `ovn.ingress_mode` from `l2proxy` to `routed`.

# Thoughts
IMO the behavior feels really wrong/unexpected - the OVN router shouldn't respond to ARPs on the UPLINK for IPs that are in a different subnet.

That said, `ingress_mode=routed` only really makes sense if you have a BGP server (which I do). `l2proxy` seems like an It Just Works kind of setting.

### Steps to reproduce

Create an OVN network with `ipv4.nat=false` as above. Deploy a VM with `images:ubuntu/noble/desktop` and observe no IP assigned to the instance's NIC.

### Information to attach

- [ ] Any relevant kernel output (`dmesg`)
- [ ] Instance log (`lxc info NAME --show-log`)
- [ ] Instance configuration (`lxc config show NAME --expanded`)
- [ ] Main daemon log (at `/var/log/lxd/lxd.log` or `/var/snap/lxd/common/lxd/logs/lxd.log`)
- [ ] Output of the client with `--debug`
- [ ] Output of the daemon with `--debug` (or use `lxc monitor` while reproducing the issue)

**Comment by tomponline** [comment]
The problem here is that the virtual router is responding to ARP requests on the **internal** side of the router, rather than just the **UPLINK** side of the router as intended.

**Comment by tomponline** [comment]
> IMO the behavior feels really wrong/unexpected - the OVN router shouldn't respond to ARPs on the UPLINK for IPs that are in a different subnet.

Indeed, and infact OVN doesn't do that in all cases. But if the UPLINK subnet contains the OVN internal subnet too (i.e the UPLINK is a super-set of the OVN internal subnet) then in `l2proxy` mode the OVN virtual router should respond to ARPs on the UPLINK side of the virtual router.

The problem here appears to be that in any case, the virtual router is also responding to ARPs on the internal side of the router, which is then upsetting Duplicate Address Detection inside guests.

**Comment by tomponline** [comment]
OVN supports the `arp_proxy` setting https://manpages.ubuntu.com/manpages/noble/man5/ovn-nb.5.html which might enable us to have more control on where ARP responses are generated.

**Comment by tomponline** [comment]
@MggMuggins see also https://github.com/canonical/lxd/issues/12814
